{"$schema":"https://json-schema.org/draft/2020-12/schema","type":"object","required":["rationale","geometry","controller","observation_request"],"properties":{"rationale":{"type":"string","description":"Your reasoning, written first: what the evidence shows, what you decided to change and why, and what result you expect. Your output label and notes summarise this."},"geometry":{"type":"object"},"controller":{"type":"object"},"observation_request":{"type":"object"}},"additionalProperties":false}
