{
  "controller": {
    "base_speed": 1.4,
    "kd": 0.9,
    "ki": 0.1,
    "kp": 7.0,
    "line_loss": "last_direction",
    "sensor_weights": [
      -1.0,
      -0.5,
      0.0,
      0.5,
      1.0
    ]
  },
  "geometry": {
    "body_length": 0.18,
    "body_width": 0.12,
    "mass": 0.8,
    "sensor_positions": [
      {
        "x": -0.06,
        "y": 0.05
      },
      {
        "x": -0.03,
        "y": 0.05
      },
      {
        "x": 0.0,
        "y": 0.05
      },
      {
        "x": 0.03,
        "y": 0.05
      },
      {
        "x": 0.06,
        "y": 0.05
      }
    ],
    "sensor_size": 0.016,
    "wheel_radius": 0.03,
    "wheel_track": 0.12
  },
  "observation_request": {
    "measurements": [
      "completion",
      "progress",
      "completion_time",
      "rms_error",
      "max_error",
      "line_loss_events",
      "steering_oscillation",
      "control_effort",
      "noise_robustness"
    ]
  },
  "rationale": "Evidence. The raced best is iteration 6 (score 94.96). Its raced design, per the outcome table, was sensors at x = -0.06 to 0.06 with y = 0.05, sensor_size 0.016, kp 7.0, ki 0.1, kd 0.6, base_speed 1.4, last_direction. The Draft Design's listed values (y = 0.07, kp 2.5, base_speed 1.3, kd 1.8 or 2.2) do not match what raced, so I do not carry them forward. The Draft's claim that iteration 6 kept the iteration 4 geometry with kd raised from 1.2 to 1.8 is also wrong. The only controller change that raced from the y = 0.05 base was kd 0.3 to 0.6, which took the score from 81.56 to 94.96. Oval progress rose from 0.33 to 0.44 and oval line-loss events fell from 1.0 to 0.5. The y = 0.07 row (iteration 5) cost about 20 points, so it stays out.\n\nKept: the raced iteration 6 design in full (geometry, kp 7.0, ki 0.1, base_speed 1.4, last_direction). Kept from the critique: the single-variable discipline, the caution about saturation at high kd, and the request for thresholds. Changed: kd 0.6 to 0.9, the only variable moved. This tests whether the kd gain on the oval continues, in a step small enough to stay clear of the saturation risk the critique raises at kd 2.2. Rejected: the Draft's kd 2.2 jump. The critique's own estimate shows that a 0.1 signal step per 10 ms at kd 2.2 is large enough to saturate the wheels, and oscillation has risen with each kd increase so far.\n\nPass and fail rules. Keep kd 0.9 if oval progress is above 0.44 and the overall score is above 94.96. If oval steering_oscillation rises above 0.37 (about 50 percent over 0.25), return kd to 0.6, the raced best. If the score falls with progress flat, the kd gain has peaked, and the next test is base_speed 1.5 on its own. Max_error is pinned near 0.063, so it is not expected to pass 0.06 at this step. The result is judged on the oval first, then on the s-bend and slalom, which the Draft and critique both flag as the weaker tracks.\n\nExpected result: oval progress about 0.47 to 0.50, overall score about 98 to 105, and oscillation about 0.28 to 0.32. Completion is not expected at this speed, and completion_time is requested to show whether base_speed is limiting progress."
}
