{
  "controller": {
    "base_speed": 0.85,
    "kd": 1.3,
    "ki": 0.0,
    "kp": 3.6,
    "line_loss": "last_direction",
    "sensor_weights": [
      -2.0,
      -1.33,
      -0.67,
      0.0,
      0.67,
      1.33,
      2.0
    ]
  },
  "geometry": {
    "body_length": 0.16,
    "body_width": 0.12,
    "mass": 0.6,
    "sensor_positions": [
      {
        "x": -0.08,
        "y": 0.07
      },
      {
        "x": -0.053,
        "y": 0.07
      },
      {
        "x": -0.027,
        "y": 0.07
      },
      {
        "x": 0.0,
        "y": 0.07
      },
      {
        "x": 0.027,
        "y": 0.07
      },
      {
        "x": 0.053,
        "y": 0.07
      },
      {
        "x": 0.08,
        "y": 0.07
      }
    ],
    "sensor_size": 0.016,
    "wheel_radius": 0.03,
    "wheel_track": 0.1
  },
  "observation_request": {
    "measurements": [
      "completion",
      "progress",
      "completion_time",
      "rms_error",
      "max_error",
      "line_loss_events",
      "steering_oscillation",
      "control_effort",
      "controller_errors",
      "noise_robustness"
    ]
  },
  "rationale": "Evidence from iteration 9 (score 719.6, best so far): the oval (20/20, 1.87 s, rms 0.0076) and s-bend (20/20, 2.09 s, max_error 0.029) are both solved with margin. The slalom is the only failing track: 20/20 off_track, but progress rose from 0.42 to 0.64 and line_loss_events is 0.2, so the 16 mm footprint and the kp 3.2 / kd 1.1 step both helped. Slalom oscillation is 0.40 and control_effort is 12.6, which leaves some room but is climbing. The robot is still drifting past the 0.06 m limit on fast alternating bends while it stays on the tape, so steering authority is still the limit. Change: raise kp from 3.2 to 3.6 for more correction per unit of signal, and raise kd from 1.1 to 1.3 so damping keeps pace (kd/kp stays near 0.36, close to the 0.34 that gave clean oval and s-bend results). Geometry, sensor weights, base_speed 0.85, ki 0 and last_direction line loss are unchanged, so the gain change is isolated. Expected result: slalom progress about 0.7 to 0.8 with max_error near 0.055 to 0.06; oval and s-bend stay at or above about 940 with steering_oscillation under about 0.3. Risks: higher kp can raise oval oscillation and control_effort, which also feeds the score's line-loss term. Hypotheses for the next race: (a) if slalom progress rises but still ends off_track near 0.75, the limit is speed on the tightest bends, so base_speed should drop to about 0.75 on the next step; (b) if oval steering_oscillation rises above 0.3, kd is too low relative to kp and should go to about 1.5; (c) if slalom line_loss_events rise above 0.5, the 16 mm footprint is overlapping background on sharp bends and 12 mm should be retested with these gains. Measurements requested: all available measurements, so per-track progress, max_error, oscillation and line-loss counts can be compared with iteration 9."
}
